Nivå_1,Nivå_2,Nivå_3,GE_KravID,Rubrik,Beskrivning,Prioritet,Status,Acceptanskriterier,ID,Arkiverad
1 - Lösningskrav,4 - LK-001 - Diariehantering,,LK-001.d,Åtkomststyrning på personnivå,All form av åtkomst till dokument och filer i lösningen ska kunna styras på personnivå.,Skall,Under testning,"
	Det ska gå att identifiera varje enskild användare 
	För varje användare ska det gå att konfigurera behörighetsprofil för åtkomst av ärenden och filer


Genererat av Chat GTP OPenAI:


Frågan löd: Presentera 3 till 5 acceptanskriterier för följande krav: All form av åtkomst till dokument och filer i lösningen ska kunna styras på personnivå.
Svaret:
	Alla användare i systemet ska ha en unik identifierare som används för att styra deras åtkomst till dokument och filer.
	Administratörer ska kunna ställa in olika nivåer av åtkomstbehörigheter för varje användare, baserat på deras roll eller befogenheter.
	Ändringar i behörigheter för en användare ska kunna spåras och loggas i systemet, så att det går att se vem som gjort ändringarna och när de gjordes.
Ytterligare två acceptanskriterier kan vara:
	Åtkomst till dokument och filer ska vara säkrade med autentisering, t.ex. användarnamn och lösenord eller tvåfaktorsautentisering.
Det 5:e avbröts och när svar regenererades blev det istället följande svar:
Här är 5 potentiella acceptanskriterier för kravet ""All form av åtkomst till dokument och filer i lösningen ska kunna styras på personnivå"":
	Alla användare i systemet ska kunna hantera tillgången till sina egna filer och dokument och bestämma vilka andra användare som kan se eller redigera dem.
	Administratörer i systemet ska kunna skapa, redigera och ta bort användares behörigheter till specifika filer och dokument.
	Systemet bör tillhandahålla en sökfunktion som gör att användare snabbt kan hitta filer och dokument som de har behörighet till.
	Åtkomsthanteringssystemet bör ge möjlighet att definiera roller med olika nivåer av behörighet, så att administratörer snabbt kan tilldela rättigheter till flera användare samtidigt.
	Systemet bör logga alla åtgärder som utförs på filer och dokument, inklusive vem som gör vad och när, för att möjliggöra spårbarhet och efterlevnad av regler och föreskrifter.



",3,Nej
38 - Integration och Interoperabilitet,41 - Lookup integration mot GE katalogtjänster,,INT-002.a,Katalogtjänstintegration,Det ska vid registrering av Diarieärende och Diariehändelse gå att ange handläggare via namnuppslag. (Uppslag på delar av namnet och även sökbart på inaktiva handläggare).,Skall,Överlämnad till förvaltning,"
	Samtliga användare som matchar sök listas
	Användarnamn och organisation är synlig
	Både nu och tidigare aktiva användare listas
",260,Nej
38 - Integration och Interoperabilitet,43 - M365,,INT-004.c,Öppna dokumentapplikationer,Initiering av dokumenteditering från Diarie.,Bör,Överlämnad till förvaltning,"
	Samtliga filformat som stöds ska kunna associeras med lämplig applikation
	Applikation associerad ska öppnas från fil bifogad i lösningen
",264,Nej
38 - Integration och Interoperabilitet,43 - M365,,INT-004.d,Sökning mot diarieposter från M365,Information i Diariesystem bör vara nåbart och sökbart från M365 för sökning och access till registerposter och handlingar.,Bör,Under testning,"
	Sharepoint instranät sök ska presentera sökresultat från Diarie
	Diarie sökträffar kan presenteras i en egen ""sökvertikal"" (Flik)
	Sökning ska ge träffar på all sökbar data i Diarie, Metadata och filinnehåll
	Sökning ska gå att förfina för att filtrera ut på typ av objekt, Ärende, händelse eller dokument samt annan relevant metadata
	Sökresultat ska ta hänsyn till användares behörighetsnivå
",265,Nej
38 - Integration och Interoperabilitet,43 - M365,,INT-004.e,Teamsintegration,Diariesystem bör erbjuda en integration för access från Teams i M365 för att initiera och bifoga filer till processerna för diarieföring av Interna och externa digitala handlingar.,Bör,Under testning,"
	Användare ska kunna diarieföra ett dokument direkt i Teams
	Vid diarieföring av dokument kan användare välja att initiera ett nytt ärende eller ny händelse
	Efter initiering ska användare kunna slutföra process till fullständig registrering genom en för användaren sammanhållen process
",266,Nej
38 - Integration och Interoperabilitet,44 - Mail/Outlook,,INT-005.a,Mailintegration,Inkommande mail skall enkelt kunna diarieföras direkt från mailklient.,Skall,Överlämnad till förvaltning,Se länkat krav VK-009.c,267,Nej
38 - Integration och Interoperabilitet,44 - Mail/Outlook,,INT-005.b,Återkoppling diarieförda mail,Mail som är diariefört bör vara ha tydlig markering att så är fallet.,Bör,Överlämnad till förvaltning,"
	Användare kan tydligt se i mailklient om mail redan är diariefört
	
",268,Nej
38 - Integration och Interoperabilitet,44 - Mail/Outlook,,INT-005.c,Hyperlänkad diariepost i mail,Från diariefört mail bör direktänk in i diarie finnas i Mailklient.,Bör,Överlämnad till förvaltning,"
	Via mailklient kan användare ha direkt åtkomst till registerpost som är relaterat till e-postmeddelande som är registrerat
",269,Nej
38 - Integration och Interoperabilitet,44 - Mail/Outlook,,INT-005.d,Utgående mail från Diarie,Initiera utgående mail från diariesystem som också diarieförs som Diariehändelse,Bör,Överlämnad till förvaltning,"
	Funktion för att initiera ett mail från Diarie baserat på registerpost
	Komplettering och sändande av mail sker sömlöst från antingen diarie eller mailklient
	Avsänt mail läggs till i ärende som ny händelse
	Metadata från mail sparas automatiskt i nya händelsen
",270,Nej
38 - Integration och Interoperabilitet,44 - Mail/Outlook,,INT-005.e,Bifoga bilagor,Initiera från Diariehändelse att sända bifogade bilagor alternativ länk till dessa i mail.,Bör,Överlämnad till förvaltning,"
	Mail kan initieras från bilaga i registerpost
	Användare kan välja mellan att skicka bilaga som bifogad fil eller länk till fil

",271,Nej
37 - Projekt och kvalitet,47 - Samarbete och transparens,,PQ-003.b,Produktionsbeslut,Beställaren ska äga rätten till slutgiltigt beslut om produktionssättning baserat på testresultat och status i leverans.,Skall,Godkänt,,249,Nej
1 - Lösningskrav,5 - LK-002 - Diarium,,LK-002.b,Filformatsstöd,"Lösningen bör stödja de vanligast förekommande MS Officefilformaten, Adobe acrobat-filer, vanligt förekommande bildformat (*.tiff) samt textfiler.",Skall,Överlämnad till förvaltning,"
	Alla filformat som stöds av lösningen ska kunna öppnas och redigeras utan att filformatet förvrängs eller förloras.
	När en fil sparas i eller exporteras från lösningen till ett av de stödda filformaten, ska filen sparas på ett sådant sätt att den kan öppnas och redigeras i andra applikationer som stöder samma filformat utan att förlora data eller formatering.
	Lösningen ska kunna hantera filer av stora storlekar utan att prestandan påverkas negativt.



Char GPT Open AI genererade AC:
Här är 3 till 5 acceptanskriterier för kravet att lösningen bör stödja de vanligast förekommande MS Office-filformaten, Adobe Acrobat-filer, vanligt förekommande bildformat (*.tiff) samt textfiler:
	Alla filformat som stöds av lösningen ska kunna öppnas och redigeras utan att filformatet förvrängs eller förloras.
	När en fil sparas eller exporteras från lösningen till ett av de stödda filformaten, ska filen sparas på ett sådant sätt att den kan öppnas och redigeras i andra applikationer som stöder samma filformat utan att förlora data eller formatering.
	Lösningen bör ha möjlighet att konvertera mellan de stödda filformaten utan att förlora data eller formatering.
	Lösningen ska kunna hantera filer av stora storlekar utan att prestandan påverkas negativt.
	Lösningen ska ge användarna möjlighet att söka efter och filtrera filer baserat på filformat.
",5,Nej
1 - Lösningskrav,5 - LK-002 - Diarium,,LK-002.d,Originalfiler,Lösningen bör stödja att filer diarieförs i originalformat.,Bör,Överlämnad till förvaltning,"
	Filer som lagts till ska finnas kvar i versionshistoriken i sitt originalformat.

",6,Nej
1 - Lösningskrav,5 - LK-002 - Diarium,,LK-002.h,Förlustfri konvertering,Konvertering ska ske utan att information går förlorad.,Skall,Överlämnad till förvaltning,"
	Formatering och information ska inte ha förändrat, förlorats eller förvanskats.



Svar från Chat GPT:
	Alla data från ursprungligt format ska bevaras efter konvertering: Ett acceptanskriterium kan vara att alla data som finns i originalformatet måste bevaras och överföras korrekt efter konvertering. Detta innebär att eventuella filer, dokument, bilder eller andra objekt som finns i det ursprungliga formatet måste bevaras och överföras korrekt efter konvertering.
	Konverterade data ska ha samma innehåll och kvalitet som originaldata: Ett annat acceptanskriterium kan vara att alla data som konverteras måste ha samma innehåll och kvalitet som originaldata. Detta innebär att alla dataelement, text, bilder, färger och annat innehåll som finns i det ursprungliga formatet ska behålla samma egenskaper efter konvertering.
	Konverteringsprocessen ska inte generera nya fel eller felaktigheter: En tredje acceptanskriterium kan vara att konverteringsprocessen inte ska generera nya fel eller felaktigheter. Detta innebär att konverteringen ska utföras på ett sätt som inte skapar nya problem, som t.ex. saknade data eller korrupta filer, som inte fanns i det ursprungliga formatet.

",10,Nej
1 - Lösningskrav,5 - LK-002 - Diarium,,LK-002.j,Roll och användarbaserad rättighetsstyrning,"Lösningen bör stödja roll och användarbaserade rättigheter för att ändra status på ett ärende så som:
- Makulerad,
- Avslutad och
- Gallrad",Bör,Överlämnad till förvaltning,"
	Ändring av status styrs av satta behörigheter för användare
	Ändras roll eller behörighet för användare så ändras även möjlighet att ändra status
",12,Nej
1 - Lösningskrav,5 - LK-002 - Diarium,,LK-002.l,Bevakningsdatum,"Lösningen bör ha en funktion för bevakningsdatum av Diarieärenden och Diraiehändelser.
Bevakningsdatum bör kunna infalla ett valbart antal dagar före sista svarsdatum.",Bör,Under testning,"
	Användare ska kunna sätta eget valbart datum
	Satt datum ska kunna uppdateras av användare
	Satt datum ska får effekt i form av notifiering eller annan typ av meddelande
",13,Nej
1 - Lösningskrav,5 - LK-002 - Diarium,,LK-002.n,Sista svarsdatum,Lösningen bör stödja funktion för att ange ett sista svarsdatum kopplat till ett Diarieärende eller diariehändelse.,Bör,Under testning,"
	Användare ska kunna sätta eget valbart datum
	Satt datum ska kunna uppdateras av användare
	Satt datum ska får effekt i form av notifiering eller annan typ av meddelande

",14,Nej
1 - Lösningskrav,5 - LK-002 - Diarium,,LK-002.o,Flytt av diariehändelser,Det bör vara möjligt att flytta diariehändelser mellan ärenden. Detta gäller även flytt av diariehändelser som flyttar mellan ärenden i skilda bolag/stiftelser inom GE-koncernen.,Bör,Överlämnad till förvaltning,"
	Det finns tydligt i användargränssnitt en funktion för att initiera en flytt av händelse.
	Processen för att flytta ska vara effektiv och när man är klar ska händelsen i sin helhet bytt plats i strukturen och fått ett nytt ärende som förälder.
	Händelser kan byta ärende mellan olika diarier
",15,Nej
1 - Lösningskrav,5 - LK-002 - Diarium,,LK-002.p,Rättigheter att flytta händelser,Lösningen bör stödja roll och användarbaserade rättigheter för att ändra hemvist på ett Diariehändelse.,Bör,Överlämnad till förvaltning,"
	Endast de roller/användare som har rätt att flytta händelser kan göra det.
	Funktionen att flytta händelser bör inte vara tillgängligt i GUI för andra användare eller roller
",16,Nej
1 - Lösningskrav,5 - LK-002 - Diarium,,LK-002.s,Automatisk filkonvertering,"Filer med vanliga filformat ska, när de läggs till i lösningen,  automatiskt konverteras till PDF som ett steg i processen av färdigställa registrering.",Skall,Överlämnad till förvaltning,"
	När händelse sätt till registrerad så ska filer konverteras till bevarandeformat.
	En ny version av händelsen har skapats och de konverterade filerna är bifogade.



",17,Nej
37 - Projekt och kvalitet,54 - Datamigrering och anonymisering,,PQ-006.a,Data att migrera,"Data att migrera från nuvarande Diarie i produktion till nya att använda under införande, kvalitetssäkring och innan produktionssättning är:
- Alla ärenden med tillhörande händelser i Diarie
- All historisk data över gamla ärenden och händelser i Diarie
- Arbetslista med samtliga pågående ärenden i väntan på kvalitetssäkring
- Alla befintliga aktiva bevakningar
- Alla befintliga aktiva sista svarsdatum
- Intakta URL:er för registerposter och filer så att gamla hänvisningar distribuerade är fortsatt effektiva
- Alla arbetsflöden
(Notera att styrande och generella dokument INTE ska migreras)",Skall,Ny,"GE kan klarlägga att:
	Rätt data migreras
	All önskad data migreras
",301,Nej
37 - Projekt och kvalitet,54 - Datamigrering och anonymisering,,PQ-006.c,Tvätt av migrerad data,"Data som ska migreras ska rensas då inte all data i dagens P360 ska finnas med i ett framtida rent Diarie i P360. Data som INTE ska finns med är:
- Styrande dokument
- Generella dokument
- Referenser mellan diarieärenden eller händelser till styrande och generella dokument",Skall,Ny,"GE kan genom test och analys av migrerad data klarlägga att:
	Inga styrande dokument finns med
	Inga generella dokument finns med
	Eventuella referenser från registerposter i Diarie till styrande eller generella dokument är borttagna
	Process för tvätt av migrerad data kan repeteras med konsistent resultat
",303,Nej
37 - Projekt och kvalitet,54 - Datamigrering och anonymisering,,PQ-006.d,Anonymisering av testdata,En process och metod för att säkert rensa och anonymisera data skall finnas att tillgå.,Skall,Ny,"GE har tillgång till en metod för anonymisering av produktionsdata som kan användas i samband med migrering av data från produktion eller produktionskopia.
Metoden kan fritt användas av GE och dess driftspartner.
Metodens källkod är tillgänglig för underhåll vid behov. (om det är ett automatiserad skript)
Metoden tar bort och ersätter alla sekretessbelagda filer.",304,Nej
1 - Lösningskrav,6 - Rollbaserade Arbetsflöden,,LK-003.c,Styra behörigheter för roller,Behörigheter att utföra steg i arbetsflödet skall gå att koppla till roller,Skall,Under testning,"
	Avsluta ärenden och sätta händelser till färdig ska endast kunna göras av tilldelad roll (Registrator)
	Flytta händelser ska endast kunna göras av tilldelad roll.
",21,Nej
1 - Lösningskrav,6 - Rollbaserade Arbetsflöden,,LK-003.e,Multipla roller per användare,Lösningen bör erbjuda möjlighet till att enskilda användare kan ha flera roller och att det går att välja vilken roll som är den aktiva.,Bör,Överlämnad till förvaltning,"
	Användare ska direkt i aktiv session kunna växla mellan roller
	Byte av roll i en och samma session ska direkt få effekt på vilka funktioner och aktiviteter användaren har tillgång till.
",22,Nej
1 - Lösningskrav,7 - Applikationsadmin och konfigurering,,LK-004.g,Administration av flervalslistor,Det ska vara möjligt att uppdatera valbara listor med fler/färre urval.,Bör,Under testning,"
	Befintliga listor ska kunna utökas, minskas eller ändras i innehåll
	Ändringar ska få direkt effekt i lösningens användargränssnitt. Kan behövas en uppdatering av session.
",28,Nej
1 - Lösningskrav,8 - Notifieringar och påminnelser.,,LK-005.c,Notifieringar vid inaktivitet,Lösningen bör stödja tidssatta notifieringar för ärenden och dokument som legat orörda eller öppna under lång tid,Bör,Under testning,"
	Användare kan ställa in på ärende eller flera ärenden att om de varit orörda (ej uppdaterade) under en viss tid så ska en notifiering ske.
	Tidsperiod skall kunna sättas individuellt per ärende
	Om ingen individuell tid sätts så ska en global tidsperiod gälla
	Notifiering sker när inställd tid uppnås.

",32,Nej
1 - Lösningskrav,8 - Notifieringar och påminnelser.,,LK-005.g,Notifieringstrigger,Notifiering ska gå ut till ansvarig och medhandläggare när ett nytt Diarieärende skapas eller tilldelas ny handläggare.,Skall,Under testning,"
	Notifiering triggas
	Notifiering adresseras avsedda roller
",35,Nej
1 - Lösningskrav,8 - Notifieringar och påminnelser.,,LK-005.h,Notifieringstrigger,Notifiering ska gå ut till ansvarig för ärendet när någon annan skapar en ny Diariehändelse.,Skall,Under testning,"
	Notifiering triggas
	Notifiering adresseras ansvarig handläggare

",36,Nej
1 - Lösningskrav,8 - Notifieringar och påminnelser.,,LK-005.j,Ärendelänk i notifieringsmeddelande,Lösningen bör stödja att länk till gällande ärende infogas i notifieringsmeddelande.,Bör,Under testning,"
	Länk bifogas
	Länk är funktionell
",37,Nej
1 - Lösningskrav,9 - Sekretess,,LK-006.c,Maskning av klassad information i presentation,"Lösningen skall stödja uppmärkning av sekretessklassade Diareärenden och Diariehändelser så att specifik information som titel och/eller avsändare/mottagare, inte visas vid presentation.",Skall (Tvingande),Under testning,"
	När sekretessmarkering sätts i ärende eller händelse så ska användare få möjlighet att dölja viss information och att skriva in alternativ information som ska presenteras
	När ärendet presenteras ska alltid den alternativa informationen presenteras
	Originalinformation ska endast visas baserat på användarens rättigheter
",40,Nej
1 - Lösningskrav,9 - Sekretess,,LK-006.e,Sekretesstid,Lösningen bör stödja möjlighet att ange sekretesstid som metadata på Diariehändelse.,Bör,Överlämnad till förvaltning,"
	Sekretessmarkering ska inte påverkas om sekretesstid har infallit eller ej
	Sekretesstid kopplat till enskilda paragrafer ska kunna ställas in
	Ärende eller händelse som lyder under specifik sekretessparagraf ska automatisk tilldelas den sekretesstiden baserat på ärendets registreringstid.
",41,Nej
1 - Lösningskrav,9 - Sekretess,,LK-006.f,Upphäva/ändra sekretess,Lösningen skall stödja möjlighet att upphäva/ändra den huvudsakliga sekretessmarkeringen för ett Diarieärende eller Diariehändelse.,Skall,Överlämnad till förvaltning,"
	Användare med behörighet till ärende eller händelse ska kunna ändra och upphäva sekretess
	Ärvda sekretessmarkeringar på händelse ska kunna avmarkeras och uppdateras att ha en oberoende sekretessnivå från andra händelser och ärende det tillhör.
	Ändrad sekretessnivå ska ha effekt på tillgänglighet av avsändare/mottager/titel samt filer i ärendet som påverkas av sekretess

",42,Nej
1 - Lösningskrav,9 - Sekretess,,LK-006.g,Organisatorisk penetretion av sekretessinformation,"Lösningen skall stödja att den ansvarige, dess överordnade chefer i organisationen, registrator samt medansvarig handläggare ska kunna se dess sekretessbelagda Diarieärenden och Diariehändelser med tillhörande filer.",Skall,Under testning,"
	Mottagare/Avsändare/titel och filer som berörs av sekretess kan ses av avsedda roller/personer och endast dessa
	Flytt av ärende mellan handläggare eller mellan organisationer skall även ha effekt på vilka överordnade som kan se den sekretessbelagda informationen och filerna.
",43,Nej
