Nivå_1,Nivå_2,Nivå_3,GE_KravID,Rubrik,Beskrivning,Prioritet,Status,Acceptanskriterier,ID,Arkiverad
1 - Lösningskrav,12 - Koncern och Bolagsstrukturstöd,,LK-008.c,Avslut av diarium,Det skall vara möjligt att avsluta ett diarium/bolag inom GE-koncernen i systemet för att hindra ytterligare registrering av nya diarieärenden och diariehändelser.,Skall,Överlämnad till förvaltning,"
	En funktion i gränssnitt för att initiera process att avsluta finns
	En tydlig process för att genomföra hela processen att avsluta ett diarium
	Avlutat diarium ska fortfarande presentera ärenden och händelser men inga ytterligare registreringar eller ändringar tillåts i diarium
",49,Nej
1 - Lösningskrav,13 - Användbarhet,,LK-009.f,Obligatoriska fält hindrande,Ej ifyllda tvingande fält bör hindra progress och avslut i skapande och uppdatering.,Bör,Överlämnad till förvaltning,"
	Användaren ska på ett tydligt sätt informeras att obligatoriska fält är saknade
	Saknade fält ska vara tydligt angivna
	Obligatoriska fält ska under ifyllande vara passivt informerande men när spara försök att gå vidare i process sker så ska de vara mer aktivt informerande
",56,Nej
1 - Lösningskrav,13 - Användbarhet,,LK-009.i,Seriell bulkinmatning med ärvd metadata,Lösningen bör erbjuda möjlighet att i serie mata in flera diariehändelser där metadata ärvs från föregående så att inmatning av nya ärenden kan göras effektivt och med konsistent innehåll.,Bör,Överlämnad till förvaltning,"
	En tidigare gjord registrering kan klonas till nya med samma information förifylld
	All information i registerpost kopieras över till nya
	Filer kopieras INTE över till klonad kopia
	Händelses händelselogg ska inte följa med i klonade kopior
	Referenser till andra registerposter ska kopieras med till ny klon
",59,Nej
2 - Verksamhetskrav,18 - Dokumenthantering styrande och formella dokument,,VK-001.c,Permanenta hyperlänkar för delning,Det bör gå att skapa permanenta länkar till filer och registerposter på samtliga hierarkiska nivåer som inte påverkas vid uppdateringar av dokument och filer.,Bör,Överlämnad till förvaltning,"
	Det ska gå att kopiera en länk
	Länken ska fungera och leda till ärende, händelse eller fil
	Även efter uppdatering av ärende eller händelse eller om händelse flyttar till annat ärende eller bolag ska länken fortsätta att fungera
	Länk till fil ska alltid i första hand leda till senast giltiga version av fil
",83,Nej
2 - Verksamhetskrav,19 - Redigering och samarbete i dokument,,VK-002.e,Dokumentstatus,Ett dokument ska sättas i en status av färdigt när registrering sker.,Skall (Tvingande),Överlämnad till förvaltning,"
	Diariehändelse (dokument) av typen intern skall sättas till status ""Registrerat"" när handläggare markerar händelse diarieförd.
	Diariehändelse av typen inkommande skall status sättas till ""Registrerat av handläggare"" när handläggare markerar händelse som diarieförd och ""Registrerat"" när registrator markerar den som klar.
	Diariehändelse av typen utgående skall status sättas till ""Färdig från handläggare"" när handläggare markerar händelse till färdigställd och ""Registrerat"" när registrator markerar den som klar
	Diariehändelse som skapas av registrator/huvudregistrator ska sättas till status ""Registrerat"" direkt vid diarieföring
",88,Nej
2 - Verksamhetskrav,19 - Redigering och samarbete i dokument,,VK-002.f,Återöppna och uppdatera dokument,Ett dokument som satts till status färdigt ska kunna öppnas för redigering som leder till en ny version i en ny diariehändelse.,Skall,Överlämnad till förvaltning,Sammanlänkat krav med kravet VK-011-j som har samma acceptans kriterier.,89,Nej
2 - Verksamhetskrav,21 - Dokument och Mallar,,VK-004.c,Metadata appliceras i filer,Lösningen ska stödja att lägga till metadata som text i filer som laddas upp och konverteras.,Skall,Under testning,"
	Den slutgiltiga konverterade filen i bevarandeformat ska innehålla vald metadata
	Pålagd metadata ska placera på en utpekad plats i filen
	Metadataplacering skall kunna specificeras i X/Y-led samt rotationsorientering per vald metadata
",97,Nej
2 - Verksamhetskrav,21 - Dokument och Mallar,,VK-004.d,Applicering av metadata till anvisade ytor i filer,Mallars utformning bör kunna bereda ytor för metadata från registerpost. Lösningen ska ha stöd för att styra metadata till förutbestämda ytor på dokument.,Skall,Under testning,"
	Metadatafält ska kunna knytas till specifika placeringar i en mall
	Olika mallar ska kunna ha egna placeringar av samma metadatafält
	Metadata ska finnas representerad på den läsbara och utskrivningsbara versionen av dokumentet
",98,Nej
2 - Verksamhetskrav,22 - Metadata,,VK-005.c,Metadata appliceras till utskrift av dokument,Valbar metadata bör kunna läggas till den printbara versionen av dokument,Bör,Under testning,Se krav VK-004.d,101,Nej
2 - Verksamhetskrav,22 - Metadata,,VK-005.d,Metadata i mallars sidhuvud och -fot,Dokument skapade baserat på mallar bör kunna få metadata applicerad i mallformatets t.ex. sidhuvud och sidfot.,Bör,Under testning,Se krav VK.004.d,102,Nej
2 - Verksamhetskrav,22 - Metadata,,VK-005.p,Fältutforming för klassning,"Fälten ska följa det klassningssystem som avtalats med IT-Säk: konfidentialitetsmärkning med sju nivåer plus ""sekretess/särskilda personuppgifter"" med fyra nivåer. Vid sekretess ska paragraf i OSL anGE:s i särskilt, obligatoriskt fält.",Skall,Överlämnad till förvaltning,"
	Val av markering skall öppna upp underliggande val adaptivt i GUI för Sekretessmarkering och särskilda personuppgifter
	Sekretessklassning ska öppna ytterligare paragrafmeny att välja ur som ska vara obligatorisk
	Särskilda personuppgifter ska öppna personuppgiftsval som ska vara obligatorisk
	Under särskilda personuppgifter med valet ""Övrigt"" tillgängliggörs ett fritextfält
	Konfidentialitetsmärkning har samtliga val i lista synlig
	Både sekretess och Särskilda personuppgifter kan väljas och då visas båda underliggande menyer
	Tas val bort på övre nivå så töms även underliggande val
",114,Nej
2 - Verksamhetskrav,22 - Metadata,,VK-005.q,Paragrafnotering,Det ska finnas fält för OSL paragrafnotering vid sekretessklassning i diarie.,Skall,Överlämnad till förvaltning,"
	En lista med valbara OSL-paragrafer finns i formulär
	Val i lista ger effekt på ärendets eller händelses tillgänglighet
	Val av sekretessnivå ger en visuell indikation i GUI att ärende eller händelse har en sekretessnivå satt
",115,Nej
2 - Verksamhetskrav,22 - Metadata,,VK-005.r,Kopplad anläggning,Det ska vara möjligt att knyta ett Diarieärende och Diariehändelse mot anläggning(plats) och adress (gatuadress) från fastställd lista av objekt.,Bör,Överlämnad till förvaltning,"
	Anläggnings och fastighetsregister kan uppdateras och nya skapas och gamla tas bort av användare systemet
	Anläggningar kan läggas till i registreringsformulär via sökning på anläggningsnamn och adress direkt i fält för Fastighet
",116,Nej
2 - Verksamhetskrav,22 - Metadata,,VK-005.s,Medansvarig i ärende,Lösningen skall stödja val och tillägg av ytterligare ansvarig handläggare (medansvarig i ärendet).,Skall,Överlämnad till förvaltning,"
	Tillägg av medhandläggare sker via uppslag mot befintliga och aktiva användarkonton
	Det bör stödja att lägga till minst 30 aktiva medhandläggare inklusive ansvarig handläggare i ett ärende
	Det ska vara väl synligt i ärendet vilka som är aktiva handläggare
",117,Nej
2 - Verksamhetskrav,22 - Metadata,,VK-005.t,Handlingstyp i diariehändelse,"Det ska i en Diariehändelse finnas möjlighet att ange handlingstyp utifrån valbara metadata t.ex. avtal, beslutsärenden.",Bör,Överlämnad till förvaltning,"
	Handlingstyp ""Handling"" är den automatisk förvalda dokumentkategorin
	
",118,Nej
2 - Verksamhetskrav,22 - Metadata,,VK-005.y,Klassificeringskod,Det ska finnas fält för klassificeringskod enligt GE:s klassificeringsstruktur.,Skall,Överlämnad till förvaltning,"
	Klassificeringskoder enligt dokumenthanteringsplanen finns att välja i registreringsformulär på ärendenivå.
	Urval i fält görs med autocomplete-sökning på antingen kod eller namn/beskrivning av klassificering
	Klassificeringskod läggs till som metadata på ärende
",122,Nej
2 - Verksamhetskrav,22 - Metadata,,VK-005.z,Alternativ information vid sekretess,Det bör finnas fält för alternativ titel/Diarieärendemening och Diariehändelsemening för presentation i samband med sekretess av originaltitel.,Bör,Överlämnad till förvaltning,"
	Fördefinierade val av offentlig titel ska presenteras i en lista
	Valen; Sätt offentlig titel lika med titel, Skydda hela offentliga titeln, Skriv in offentlig titel manuellt.
	Vid val ""Skriv in offentlig titel manuellt"" ska ytterligare fält öppnas för att ange offentlig titeltext 
",123,Nej
2 - Verksamhetskrav,23 - Gallring,,VK-006.b,Massgallring,Det bör finnas funktion för både gallring av enstaka filer samt massgallring.,Bör,Överlämnad till förvaltning,"
	Markera enskild eller flertalet filer för gallring
	Filer försvinner efter fullföljd gallring från användargränssnitt i P360 samt vid sökning direkt i lösningens databas
",125,Nej
2 - Verksamhetskrav,23 - Gallring,,VK-006.c,Automatiserad gallringsprocess,Lösningen bör erbjuda stöd för schemalagd och regelbaserad generering av urvalslistor för massgallring,Bör,Under testning,"
	Administratör eller användare kan skapa schemalagda rutiner för generering av filer för gallring enligt regler
	Generering av urvalslistor sker vid tidpunkt i rutin
	Urvalslista återspeglar satta regler för urval
	Urvalslista kan användas direkt för markering av filer som ska gallras
",126,Nej
2 - Verksamhetskrav,23 - Gallring,,VK-006.d,Kontrollsteg för start av gallring,Det ska finnas manuellt godkännande eller manuell start för gallringsjobb.,Skall,Överlämnad till förvaltning,"
	Inget gallras ur lösningen utan att auktoriserad användare exekverar gallringsprocess
	Endast filer markerade i urvalslista gallras
",127,Nej
2 - Verksamhetskrav,"24 - Sök, filtrering, utskrift och export",,VK-007.a,Utskrift av sökresultat,Lista på sökträff bör kunna exporteras eller skrivas ut.,Bör,Under testning,"
	Hela eller valda delar i sökresultat skall kunna exporteras eller skrivas ut direkt från lösningen
	Export till Excel/CSV ska innehålla de valda kolumnerna i sökresultatet
",130,Nej
2 - Verksamhetskrav,"24 - Sök, filtrering, utskrift och export",,VK-007.f,Söktermer bestående av flera ord,Systemet skall stödja en kombinerad och filtrerad sökfunktion där sökning efter dokument kan göras på flera ord.,Skall,Överlämnad till förvaltning,"
	Sökning på flera ord är utsökta med ""ELLER"" som operator i logik så även icke existerande ord i sökning resulterar i resultat på de ord som har träff.
	Sökresultat ska presenteras för alla hierarkiska nivåer
",135,Nej
2 - Verksamhetskrav,"24 - Sök, filtrering, utskrift och export",,VK-007.g,Sökbar metadata,All metadata skall vara sökbar,Skall,Överlämnad till förvaltning,"
	Alla typer av metadata ska vara sökbara
",136,Nej
2 - Verksamhetskrav,"24 - Sök, filtrering, utskrift och export",,VK-007.h,Riktad sök,"Sökning skall kunna rikta sökning till enbart enskilda kategorier, exempelvis registerposter, filinnehåll, filnamn alternativt hela massan.",Skall,Överlämnad till förvaltning,"
	Endast resultat där sökterm stämmer med kategorin på det riktade sökningen presenteras
	Även sökning i bevarandeformatsfiler
	
",137,Nej
2 - Verksamhetskrav,"24 - Sök, filtrering, utskrift och export",,VK-007.k,Sökning över samtliga status,Sökning skall kunna söka och presentera resultat oavsett status på registerpost.,Skall,Överlämnad till förvaltning,"
	Sökning kan ske på all metadata och innehåll oavsett ärendestatus
",140,Nej
2 - Verksamhetskrav,"24 - Sök, filtrering, utskrift och export",,VK-007.l,Postlista,Det ska finnas en förteckning över samtlig diarieförd korrenspondens (postlista) för utskrift och export.,Skall,Överlämnad till förvaltning,"
	Postlista genererad är komplett för angiven datumperiod
",141,Nej
2 - Verksamhetskrav,"24 - Sök, filtrering, utskrift och export",,VK-007.n,Användarspecifika rapporter,Det bör vara möjligt för användare av lösningen att skapa och spara egendefinierade rapporter.,Bör,Under testning,"
	Användare kan välja att spara sökning/rapport med ett eget namn för återanvändning
	Sparade egna rapporter och sökningar kan tas bort av användare
	
",143,Nej
2 - Verksamhetskrav,"24 - Sök, filtrering, utskrift och export",,VK-007.o,Export av rapporter,Samtliga rapporter bör kunna exporteras till vanligt förekommande filformat.,Bör,Under testning,"
	Användare kan exportera till olika format, Excel, word, PDF........
",144,Nej
2 - Verksamhetskrav,"24 - Sök, filtrering, utskrift och export",,VK-007.p,Export av information i Gallrade registerposter,Lösningen bör stödja export av information tillhörande gallrade Diarieärenden och diariehändelser.,Bör,Under testning,"
	Fungerar på samma sätt som andra rapporter/sökningar
",145,Nej
2 - Verksamhetskrav,"24 - Sök, filtrering, utskrift och export",,VK-007.q,Skicka fil som bilaga,Lösningen bör stödja att skicka filer som bilaga ur systemet via e-post.,Bör,Överlämnad till förvaltning,"
	Från en diariehändelse kan användare att skicka en bilaga direkt som e-post
	Filer bifogas till epostmeddelande i epostklient
	Skickad bilaga ska noteras som ny händelse 
",146,Nej
2 - Verksamhetskrav,"24 - Sök, filtrering, utskrift och export",,VK-007.s,Öppna filer direkt från sökresultat,Lösningen bör stödja att öppna filer direkt från sökresultatet.,Bör,Överlämnad till förvaltning,"
	Samtliga filer i Office- samt godkända arkivformat öppnas och kan läsas och redigeras direkt från sökresultat
",148,Nej
2 - Verksamhetskrav,"24 - Sök, filtrering, utskrift och export",,VK-007.t,JK-lista ärendebalans,"Det bör vara möjligt att ta ut en nationellt definierad ""JK-lista"" över ärendebalans i diariet.",Bör,Överlämnad till förvaltning,"
	Lösningens användargränssnitt har en tydlig funktion för generering av lista med ärendebalans
	Från och till-datum går att ange för listans tidsperiod
	Funktionen genererar en lista med sökresultat i användargränssnitt
",149,Nej
2 - Verksamhetskrav,"24 - Sök, filtrering, utskrift och export",,VK-007.x,Sökresultat tar hänsyn till behörighet,Sökfunktion ska ta hänsyn till den inloggade användarens behörigheter för information i filer samt avskilda delar av registerposter.,Skall,Överlämnad till förvaltning,"Tre alternativ finns för skydd: Offentlig titel är samma som originaltitel, Offentlig titel är annan än originaltitel, Titel är helt dold.
Ett av de tre alternativen sätts efter att registerpost skyddats med sekretessmarkering.


	Sökresultat ska bara visa information och filer som motsvarar användares behörighetsnivå
	Registerposter skyddade med bara sekretessmarkering ska finnas med i sökresultat för alla användare
	Ärenden och händelser som är skyddade med dold titel ska utelämnas helt ur sökresultat för användare med ej tillräcklig behörighet
	Skyddade registerposter med dold titel ska visas för användare med tillräcklig behörighet
	Både dold originaltitel och offentlig titel och information i registerposter som omfattas av sekretess ska ge träff i sökningar för behörig användare
",152,Nej
2 - Verksamhetskrav,"24 - Sök, filtrering, utskrift och export",,VK-007.ä,Spara sökparametrar,Sökningen ska kunna sparas för kommande återsökningar.,Bör,Överlämnad till förvaltning,"
	Användare kan spara sökning
	Användare kan välja att använda tidigare sparad sökning
	Sparad sökning kan ändras och sparas om som samma eller ny sparad sökning
	Sökningar ska kunna delas mellan användare via delning
",156,Nej
2 - Verksamhetskrav,"24 - Sök, filtrering, utskrift och export",,VK-007.öa,Sök på aktivitetsdatum,Lösningen bör stödja att det på Diarieärende går att söka på senaste aktivitetsdatum.,Bör,Överlämnad till förvaltning,"
	Sökkriterie aktivitetsdatum finns i sökning
	Sökning t.o.m och f.o.m aktivitetsdatum
",158,Nej
2 - Verksamhetskrav,"24 - Sök, filtrering, utskrift och export",,VK-007.öc,Export av komplett diarium,Det ska gå att exportera diariet och de filer som lagras i lösningen till ett e-arkiv eller ett annat diarium.,Skall,Under testning,"
	E-arkiv fil (SIP*) går att generera
	Mottagare av SIP kan ta emot och validera dess riktighet
	Nytt diarium kan importera SIP och all information är bevarad


*SIP Submission Information Package enligt OAIS-modell
",160,Nej
2 - Verksamhetskrav,25 - Sammanläkning och korsreferenser,,VK-008.c,Koppling mellan relaterade ärenden,Det skall gå att koppla Diarieärenden till varandra för att visa på att de har ett logiskt samband. Kopplingen ska kunna göras även mellan ärenden diarieförda i olika bolag inom GE-koncernen.,Skall,Överlämnad till förvaltning,"
	Användare kan med diarienummer skapa en ärendereferens i ett ärende skapa en dubbelriktad koppling mellan ärenden
	Ärendekoppling utgörs av en aktiv hyperlänk som tar användare direkt mellan relaterade ärenden
	Sekretessmarkering och dolda titlar ska ha effekt på koppling mellan ärenden så att dold information inte röjs för ej behöriga användare
",163,Nej
2 - Verksamhetskrav,25 - Sammanläkning och korsreferenser,,VK-008.d,Koppling mellan händelser,Lösningen bör stödja sammanlänkning av Diariehändelser i olika Diarieärenden så att användare  enkelt kan hitta och öppna dem.,Bör,Överlämnad till förvaltning,"
	Användare kan med dokumentreferens i en händelse skapa en dubbelriktad koppling mellan händelser
	Händelsekoppling utgörs av en aktiv hyperlänk som tar användare direkt mellan relaterade händelser
	Sekretessmarkering och dolda titlar ska ha effekt på koppling mellan händelser så att dold information inte röjs för ej behöriga användare

",164,Nej
2 - Verksamhetskrav,26 - Dokument och filimport,,VK-009.b,Dra och släppa för att bifoga filer,"Det bör finnas stöd för ”drag and drop” för handling (dokument, filer) till Diariet.",Bör,Överlämnad till förvaltning,"
	Användare kan dra och släppa enstaka eller grupper av filer direkt in till en händelse
	Samtliga godkända filformat ska gå att dra och släppa för att bifoga filer
	Drar och släpps en eller flera filer direkt till ett ärende så skapas en händelse med samtliga filer bifogade
	Filer ska kunna dras och släppas i P360 webbgränssnitt eller Outlooks sidopanel med samma resultat
",166,Nej
2 - Verksamhetskrav,26 - Dokument och filimport,,VK-009.c,Diarieföra relaterade e-postmeddelanden direkt från e-postklient,Vid utgående eller inkommande e-post knutet till ett ärende ska det vara möjligt att via integration diarieföra detta mailflöde som handling med ev. bilagor.,Skall,Överlämnad till förvaltning,"
	Användare kan bifoga mail till befintligt ärende som ny händelse


Diarieföra e-post via sidopanel :
	i en skapad diariehändelse i webbgränssnittet P360.
	Man skapar alltså först en diariehändelse i P360 och går sedan till Outlook. Där söker man fram diariehändelsen i sidopanelen och lägger sedan till mail inklusive bilagor
	Direkt via sidopanelen i outlook och därmed samtidigt skapa diariehändelsen.
	Man drar och släpper mailet till ""Skapa dokument och möten"" i sidopanelen i Outlook. Man får då upp ett registreringsformulär för en diariehändelse

",167,Nej
2 - Verksamhetskrav,29 - Processflöde Diarium,,VK-011.c,Redigerbara metadata,Metadatafält ska vara redigerbara i samtliga fall utom där det specifikt anges.,Skall,Överlämnad till förvaltning,"
	Redigerbara metadatafält kan så länge ärendet ej är avslutat av handläggare vara redigerbara
	Redigerbara metadatafält kan alltid redigeras av huvudregistrator oavsett status på ärende
",179,Nej
2 - Verksamhetskrav,29 - Processflöde Diarium,,VK-011.e,Massavslut av ärenden,Det ska finnas möjlighet att massavsluta ärenden baserat på metadata med hänsyn taget till behörighet.,Skall,Överlämnad till förvaltning,"
	Via funktion för massuppdatering kan ärenden sökas och filtreras till en lista
	Ärenden i lista kan markeras enstaka eller flertalet
	Markerade ärenden kan avslutas via gemensamt
	Ärenden som inte har samtliga förutsättningar för att avslutas ska ge ett fel utan att påverka avslutsprocess på de övriga i listan som har alla förutsättningar för att avslutas
	Avslutsprocessen ska ge en tydlig visuell indikation till användare att processen har fullföljts för samtliga ärenden som avslutats 
",181,Nej
2 - Verksamhetskrav,29 - Processflöde Diarium,,VK-011.f,Återöppnande avslutade ärenden,Det ska vara möjligt att återöppna avslutade ärenden och vid behov kunna justera dessa och lägga till nya handlingar.,Skall,Överlämnad till förvaltning,"
	Återöppnat ärende ska få status som indikerar att det är åter under behandling
	Återöppnat ärende kan editeras och läggas till nya händelser
	Ärende kan avslutas igen med ändrad information tillagd
",182,Nej
2 - Verksamhetskrav,29 - Processflöde Diarium,,VK-011.i,Handläggares organisatoriska tillhörighet,"När vald handläggarens namn presenteras bör även organisationstillhörigheten (VO, AVD och Enhet) presenteras.",Skall,Överlämnad till förvaltning,"
	i Valbara listor som hämtar användardata från katalogtjänst (AD) ska även organisation visas jämte namn.
	Hela strängen med namn och organisation ska vara formaterad så den syns i listan på ett tydligt sätt.
",185,Nej
2 - Verksamhetskrav,29 - Processflöde Diarium,,VK-011.j,Skrivskydd vid avslut,Ärendet ska vid avslut skrivskyddas och datum för avslut ska läggs till per automatik.,Skall,Överlämnad till förvaltning,"
	Efter avslut ska inte metadata eller händelser och bifogade dokument inte kunna ändras av handläggare
	Huvudregistrator ska kunna återöppna för att redigera
",186,Nej
2 - Verksamhetskrav,29 - Processflöde Diarium,,VK-011.k,Massuppdatering av handläggare,Lösningen ska stödja byte av handläggare på flera Diarieärenden samtidigt.,Skall,Överlämnad till förvaltning,"
	Det ska gå att söka fram ärenden som är tilldelad en huvud eller medhandläggare för att massuppdatera till ny huvud eller medhandläggare
	Det ska gå att massuppdatera så att en medhandläggare blir huvudhandläggare i flera ärenden 
",187,Nej
2 - Verksamhetskrav,29 - Processflöde Diarium,,VK-011.p,Kloning av befintliga registerposter,Det bör vara möjligt att skapa nya Diarieärenden och Diariehändelser baserat på befintliga med bibehållen information.,Bör,Överlämnad till förvaltning,"
	Det ska gå att skapa nytt diarieärende från ett befintligt genom att kopiera det befintliga ärendet
	Det ska gå att skapa en ny händelse i samma ärende genom att kopiera ett befintlig händelse
	Det ska gå att skapa en ny händelse i ett nytt eller annat ärende genom att kopiera ett befintlig händelse
",192,Nej
2 - Verksamhetskrav,29 - Processflöde Diarium,,VK-011.q,Arv av metadata till underordnad registerpost,"Diariehändelser ska ärva Diarieärendets sekretessnivå och konfidentialitetsmärkning, men detta ska kunna ändras på varje enskild Diariehändelse.",Skall,Överlämnad till förvaltning,"
	All metadata ärvs automatiskt från ärende till nya händelser i ärendet
	Sekretessnivå
	Konfidentialitetsnivå
	Ansvarig handläggare
	All metadata som ärvts kan redigeras i händelse
	Kontakt och medhandläggare ska kunna följa med via funktion och aktivt val av användare när händelse skapas
",193,Nej
2 - Verksamhetskrav,29 - Processflöde Diarium,,VK-011.v,Massuppdatering av metadata i Diarieärende,"Lösningen skall stödja massuppdatering av men inte begränsat till listade metadata i ett Diarieärende:
- Ansvarig handläggare
- Ärendestatus",Skall,Överlämnad till förvaltning,"Se länkade krav VK-011.k


	Metadata som är redigerbar ska kunna massuppdateras i flertalet ärenden

",198,Nej
2 - Verksamhetskrav,29 - Processflöde Diarium,,VK-011.y,Massuppdatering av metadata i Diariehändelse,"Lösningen skall stödja massuppdatering av men inte begränsat till listade metadata i en Diariehändelse:
- Ansvarig handläggare
- Händelsestatus",Skall,Överlämnad till förvaltning,"
	Händelser, oavsett om de tillhör olika ärenden ska kunna massuppdateras
",200,Nej
36 - Kapacitet och Stabilitet,39 - Kapacitet,,KS-001.c,Sökprestanda,Sökningar bör generera resultat utan dröjsmål och endast i fall där sökning genererar ett mycket stort antal träffar accepteras ett fördröjt svar dock aldrig mer än 5 sekunder.,Bör,Överlämnad till förvaltning,"
	I produktionsmiljö eller i produktionsliknande miljö med produktionsdata ska sökningar göras som ger stora sökresultat med uppnådd prestandakrav
	Sökning sker från klient i GE's nätverk mot produktionsservar hos driftspartner
",233,Nej
36 - Kapacitet och Stabilitet,39 - Kapacitet,,KS-001.d,Bulkuppdateringsvolym,Funktioner för massuppdatering bör klara att hantera upp till 300 ärenden eller händelser åt gången.,Bör,Överlämnad till förvaltning,"
	Uppdatering går att göra med upp till max kravställda volymer
",234,Nej
36 - Kapacitet och Stabilitet,39 - Kapacitet,,KS-001.e,Bulkuppdatering minvolym,Funktioner för massuppdatering ska klara att hantera minst 50 ärenden eller händelser åt gången.,Skall,Överlämnad till förvaltning,"
	Uppdatering går att göra med upp till max kravställda volymer
Se krav KS-001.d för maxvolymkrav
",235,Nej
